{
  "atlas": {
    "cell": 128,
    "file": "icons/atlas.2d7f2d93.webp",
    "height": 768,
    "width": 768
  },
  "generatedAt": "2026-10-19T03:27:00.153Z",
  "glyphAtlas": {
    "cell": 128,
    "file": "icons/glyph-atlas.d38a84a3.webp",
    "height": 256,
    "width": 256
  },
  "glyphSprite": {
    "file": "icons/glyphs.3ae1d408.svg"
  },
  "hash": "c9005a33",
  "icons": {
    "alt": {
      "checkedAt": "2026-10-19T03:27:00.153Z",
      "favicon": {
        "x": 0,
        "y": 0
      },
      "glyph": {
        "symbol": "g-alt"
      },
      "hash": "3bae2ab44cb92c756000fba16f3239f5bf1de2f7c03aaed9327bc160be46aaf4",
      "locked": false,
      "palette": null,
      "seed": null,
      "shape": "default",
      "status": "found",
      "tint": null
    },
    "criteria-builder--meridian": {
      "checkedAt": "2026-10-19T03:27:00.153Z",
      "favicon": {
        "x": 128,
        "y": 0
      },
      "glyph": {
        "atlas": {
          "x": 0,
          "y": 0
        }
      },
      "hash": "225f951682192c0b53c447fafc70121e45e70f680c54e67da2614cb9040c1d4c",
      "locked": false,
      "palette": null,
      "seed": "1f2e3d4c",
      "shape": "default",
      "sourceTint": [
        "#9889b7",
        "#d6caee",
        "#483962"
      ],
      "status": "found",
      "tint": [
        "#827ba6",
        "#c0bbdb",
        "#352d52"
      ]
    },
    "criteria-builder--rubric": {
      "checkedAt": "2026-10-19T03:27:00.153Z",
      "favicon": {
        "x": 256,
        "y": 0
      },
      "glyph": {
        "symbol": "g-criteria-builder--rubric"
      },
      "hash": "4b35e4edfee992a2dac68c522b1a2dc910f4c6e932083314506034c776df38ba",
      "locked": false,
      "palette": null,
      "seed": "1f2e3d4c",
      "shape": "default",
      "sourceTint": [
        "#9884ce",
        "#d5c8fd",
        "#493375"
      ],
      "status": "found",
      "tint": [
        "#9983d4",
        "#d4ccf0",
        "#4a3278"
      ]
    },
    "dafter": {
      "checkedAt": "2026-10-19T03:27:00.153Z",
      "favicon": {
        "x": 384,
        "y": 0
      },
      "glyph": {
        "symbol": "g-dafter"
      },
      "hash": "cc771bfffa36e680936fd0526689cd1242d4c413cf809825c73ef0227018f0bf",
      "locked": false,
      "palette": null,
      "seed": "1f2e3d4c",
      "shape": "default",
      "status": "found",
      "tint": [
        "#698cf0",
        "#bed0fd",
        "#273c81"
      ]
    },
    "draw": {
      "checkedAt": "2026-10-19T03:27:00.153Z",
      "favicon": {
        "x": 512,
        "y": 0
      },
      "glyph": {
        "symbol": "g-draw"
      },
      "hash": "5d26f3072cc7bac1b54ab872c68039116f0521529e1fbfac938a943579fb2487",
      "locked": false,
      "palette": null,
      "seed": null,
      "shape": "default",
      "status": "found",
      "tint": null
    },
    "drug-list--free": {
      "checkedAt": "2026-10-19T03:27:00.153Z",
      "favicon": {
        "x": 640,
        "y": 0
      },
      "glyph": {
        "symbol": "g-drug-list--free"
      },
      "hash": "eee4a4b9c426b6db036103b3427ffbd5874f9306fac7a6bdee5df4c66fbc3ed2",
      "locked": false,
      "palette": null,
      "seed": "1f2e3d4c",
      "shape": "default",
      "sourceTint": [
        "#de6e39",
        "#ffc1a7",
        "#702900"
      ],
      "status": "found",
      "tint": [
        "#e26c29",
        "#f2c7b4",
        "#6e2c02"
      ]
    },
    "drug-list--full": {
      "checkedAt": "2026-10-19T03:27:00.153Z",
      "favicon": {
        "x": 0,
        "y": 128
      },
      "glyph": {
        "symbol": "g-drug-list--full"
      },
      "hash": "2825ceeaea5b02ef0d5ac0017e37b2bcd8e1dfc32a851760ab895a5482299d33",
      "locked": false,
      "palette": null,
      "seed": "1f2e3d4c",
      "shape": "default",
      "sourceTint": [
        "#928bba",
        "#d1ccf0",
        "#433b65"
      ],
      "status": "found",
      "tint": [
        "#908abd",
        "#cfcbf2",
        "#413a66"
      ]
    },
    "entity-tracker": {
      "checkedAt": "2026-10-19T03:27:00.153Z",
      "favicon": {
        "x": 128,
        "y": 128
      },
      "glyph": {
        "symbol": "g-entity-tracker"
      },
      "hash": "a23195dca17dc25eca53a3dc3f48f30c5a69daf2ab93d28bff57e4646c6914e5",
      "locked": false,
      "palette": null,
      "seed": "1f2e3d4c",
      "shape": "default",
      "sourceTint": [
        "#569db6",
        "#a6daee",
        "#014a5d"
      ],
      "status": "found",
      "tint": [
        "#5992b0",
        "#a5cfe6",
        "#0d4157"
      ]
    },
    "id-dates--contacts": {
      "checkedAt": "2026-10-19T03:27:00.153Z",
      "favicon": {
        "x": 256,
        "y": 128
      },
      "glyph": {
        "symbol": "g-id-dates--contacts"
      },
      "hash": "8bed47d27fa1725be6387fadb31817140afa8f00325e21c5552443de1b466a02",
      "locked": false,
      "palette": null,
      "seed": "1f2e3d4c",
      "shape": "default",
      "sourceTint": [
        "#e3674b",
        "#fec0b1",
        "#75220f"
      ],
      "status": "found",
      "tint": [
        "#d05a2d",
        "#ecb19c",
        "#5e1e03"
      ]
    },
    "id-dates--id": {
      "checkedAt": "2026-10-19T03:27:00.153Z",
      "favicon": {
        "x": 384,
        "y": 128
      },
      "glyph": {
        "symbol": "g-id-dates--id"
      },
      "hash": "912d137a01086f42952a9019aed9cb84d85da96d3d66d58e2aa63caf24d1178a",
      "locked": false,
      "palette": null,
      "seed": "1f2e3d4c",
      "shape": "default",
      "sourceTint": [
        "#cc7b49",
        "#fcc3a2",
        "#693005"
      ],
      "status": "found",
      "tint": [
        "#c17c40",
        "#f2c39c",
        "#5f3203"
      ]
    },
    "index-builder": {
      "checkedAt": "2026-10-19T03:27:00.153Z",
      "favicon": {
        "x": 512,
        "y": 128
      },
      "glyph": {
        "symbol": "g-index-builder"
      },
      "hash": "aae3355891d172f83f14846d5537e905a8ed0b9e92154442c15a580dd5767c89",
      "locked": false,
      "palette": null,
      "seed": "1f2e3d4c",
      "shape": "default",
      "sourceTint": [
        "#6b9f8f",
        "#b4dbce",
        "#184d3f"
      ],
      "status": "found",
      "tint": [
        "#689884",
        "#afd4c4",
        "#164736"
      ]
    },
    "ledger-form--folio": {
      "checkedAt": "2026-10-19T03:27:00.153Z",
      "favicon": {
        "x": 640,
        "y": 128
      },
      "glyph": {
        "atlas": {
          "x": 128,
          "y": 0
        }
      },
      "hash": "490593a1812b6e19bf2644d597eb899409d517606ba1fabd6e64c73b2a94b139",
      "locked": false,
      "palette": null,
      "seed": null,
      "shape": "default",
      "status": "found",
      "tint": null
    },
    "ledger-form--tally": {
      "checkedAt": "2026-10-19T03:27:00.153Z",
      "favicon": {
        "x": 0,
        "y": 256
      },
      "glyph": {
        "symbol": "g-ledger-form--tally"
      },
      "hash": "8dd72acfdcb5141b1936a2eee31d5ddeb1ebd0b02d7a2eb730444383c5a2f80a",
      "locked": false,
      "palette": null,
      "seed": "1f2e3d4c",
      "shape": "default",
      "sourceTint": [
        "#d77250",
        "#fdc1ad",
        "#742301"
      ],
      "status": "found",
      "tint": [
        "#d37059",
        "#f0c2b7",
        "#702110"
      ]
    },
    "paid-calculator--calc": {
      "checkedAt": "2026-10-19T03:27:00.153Z",
      "favicon": {
        "x": 128,
        "y": 256
      },
      "glyph": {
        "symbol": "g-paid-calculator--calc"
      },
      "hash": "45e1c362fe288459db868dc01c5702dac201f105a072783dc7708f090edca1ce",
      "locked": false,
      "palette": null,
      "seed": "1f2e3d4c",
      "shape": "default",
      "sourceTint": [
        "#8092b8",
        "#c3d1ef",
        "#334263"
      ],
      "status": "found",
      "tint": [
        "#7992b5",
        "#bcd0ec",
        "#2c4160"
      ]
    },
    "paid-calculator--daleel": {
      "checkedAt": "2026-10-19T03:27:00.153Z",
      "favicon": {
        "x": 256,
        "y": 256
      },
      "glyph": {
        "symbol": "g-paid-calculator--daleel"
      },
      "hash": "2f451cfd01cda20b72b91e32b15e2db928de25d66c7ac7b57bbf234dd1aaae74",
      "locked": false,
      "palette": null,
      "seed": null,
      "shape": "default",
      "status": "found",
      "tint": null
    },
    "parser": {
      "checkedAt": "2026-10-19T03:27:00.153Z",
      "favicon": {
        "x": 384,
        "y": 256
      },
      "glyph": {
        "symbol": "g-parser"
      },
      "hash": "1a18695233e8077bfbcddb20d3f273f66b4df80b452f15f40184f312f4193e6e",
      "locked": false,
      "palette": null,
      "seed": "1f2e3d4c",
      "shape": "default",
      "status": "found",
      "tint": [
        "#bc73be",
        "#f4baf4",
        "#612664"
      ]
    },
    "pharmacy-tools--bugvert": {
      "checkedAt": "2026-10-19T03:27:00.153Z",
      "favicon": {
        "x": 512,
        "y": 256
      },
      "glyph": {
        "symbol": "g-pharmacy-tools--bugvert"
      },
      "hash": "11c0771204a7b4cd7394beb081fd25be03056f55193961a0c73621247dd230ff",
      "locked": false,
      "palette": null,
      "seed": "1f2e3d4c",
      "shape": "default",
      "sourceTint": [
        "#c97a64",
        "#fec0af",
        "#6f2914"
      ],
      "status": "found",
      "tint": [
        "#c07463",
        "#f6b8ab",
        "#672415"
      ]
    },
    "pharmacy-tools--pillbug": {
      "checkedAt": "2026-10-19T03:27:00.153Z",
      "favicon": {
        "x": 640,
        "y": 256
      },
      "glyph": {
        "symbol": "g-pharmacy-tools--pillbug"
      },
      "hash": "17c0e92428ffb0599e289e7d97f56f7ab14d7b4acce91d5467a86bd3d7754216",
      "locked": false,
      "palette": null,
      "seed": "1f2e3d4c",
      "shape": "default",
      "sourceTint": [
        "#d27556",
        "#fdc1ad",
        "#742301"
      ],
      "status": "found",
      "tint": [
        "#c16f42",